level_0,index,batch,series,date,ed,seq,sourceFrame,issue,pos,collation,pp,sections,replabel,repnote,height,width,frame,id,text,sourceFile,section
13865,13865,dlc_charitee_ver01,/lccn/sn82014726,1919-11-21,1,5,0771,https://chroniclingamerica.loc.gov/data/batches/dlc_charitee_ver01/data/sn82014726/00517173137/1919112101/1919112101_1.xml,4,8,8,[],,Present,6831.0,5349.0,771.0,https://chroniclingamerica.loc.gov/data/batches/dlc_charitee_ver01/data/sn82014726/00517173137/1919112101/1919112101_1.xml#pageModsBib5,"2 «
das welsce dïmmer.
— —
RNoman von Fergus Hume.
al. dFertiehuna.)
16. Kapitel.
Tracey blieb in dem Häuschen,
welches die ermordete Frau Brand
bewohnt hatte. Er hatte es sich so
behaglich wie möglich gemacht und
lebte als praktischer Junggeselle. Er
tochte sich sein Essen selber, machte
sich sein Bett und hielt die Wohnung
so sauber, daß man dos Walten einer
weiblichen Hand kaum vermißte. Ei—
nes Tages tam Gerda in Begleitung
ihrer Mutter zu ihm. Tracey wun­
derte sich nicht leicht üter etwas, als
er aber sah, wie Gerda die schwer­
fällige, plumpe Frau oern Garten--
weg entlang führte oder vielmehr zog,
ba staunte er üter alle Maßen. Bald
darauf traten die beiden Damen in
das Zimmer. -
„Ach, was ich ausgestanden habe!“
stöhnte Frau Laldwin abgebrochen
und sank in einen Korbstuhi, der un­
ter ihrer Last in allen Fugrn krachte.
„Sie können sich teinen Beariff ma--
chen!“ Dann holte sie et. paar—-
mal tief Atem.
„Und was sührt! Sie .n—, liebe
Mutter?“ fragte Tracey, der sch bei
dem komischen Anblick, den seitte zu—
künftige Schwiegermntter boi, das
Lachen kaum verbeiten konnte.
Frau Baldwin teuchte und schnapp­
te nach Luft, während sie sich iutt
ihrem Taschentuch Kühlung zufachelt-.
„Wenn Sie so as wie ein Gläs­
chen Wein hier haben“, — begann sie.
„Nur Kognak — aber guten al—
ten,“ unterbrach se Tracey und
brachte ihr ein Glas voll, das Frau
Baldwin schnell leerte, obgleich sie
vorher behauptet, sie trinke nie „sel--
ches Zeuz“. —
„Lassen Tie rh einstweilen von
Gerda 'was - hylen/“ sagte sie.
Ludwiz Tracey sah seine Braut
fragend an. Es mußte etwas ganz
Außergewöhnliches geschehen sein,
sonst wäre Frau Baldwin nicht zu
ihm gekommen.
„Mama ist außer sich, denn sie
behauptet, ihren Gatten gesehen zu
haben.“
„Meinen zweit n natürlich,“ fiel
Frau Baldwin en.
„Ich denke, ec ist tot und längst
begraben?“
„Nein, ich weiß nichts davon, daß
er tot ist. Er lebt und ich habe ihn
gesehen. Vor zwei Tagen lag ich im
Wohnzitnmer auf dem Sofa und
sut meine erregten Nerven durch
ea zu beruhigen. Da erschien Ru—-
colf plötzlich draußen vor dem offenen
Fenster. Ich schrie läut auf, als
ich sein Gesicht erblickte. Da rannte
er davon, so schnell er konnte. Als
ich hinaus sah, war er verschwunden.
Und nun komme ich zu Ihnen, um
Sie zu bitten, einen Aufruf an Ru—
dolf in die Zeitungen „zu setzen.
Schreiben Sie, es solle alles verges­
sen sein.“ -
„Was soll denn vergessen sein?“
warf hier Gerda ein.
Frau Baldwin reckte sich plötzlich
kerzengerade empor und ihre Augen
glühten unheimlich. Kein Menh
hätte ihr eine solche Lebhaftigkeit und
Leidenschaftlichteit zugetraut „Ja—
wohl,“ sagte sie mit harter Stimme,
„es gibt da sehr viel zu vergessen.
Mein zweitert Mann behandelte mich
brutal! Er war ein ganz schlechter
Mensch!“
„Und warum willst Du das ver—
gessen und “ auch vergeben?“
: „Weill ci mi!“ versetzte ihre
mu t in
an 3n Cle ließe den er-
Lrmlichen erl la en. Der.len S­
un e Keinder!
„Ich maochte ihn abtr zurü?? ga—
den.“ erwiderte Frau Ecdwin. „Es
alles vergeben und vergessen
ein.“ —
Toch währcn ke das sagte, be­
ertle Trey ein tückisches Glitzern
Augen, welches ihre Worte
x traste. Tracey war über­
ger, daß es tein edler Beweggrund
war, warum Frau Baldwin ihren
Gatten zurückwünschte. Vielleicht
wollte e ihm die Hölle heiß ma—
chen?
„Sagen Sie mir offen und ehrlich,
warum se ihn zurückwünschen,“ sagte
er plötzli.).
Frau Baldwin holte tief Atem.
Dann segte sie mit einem Blick auf
ihre Tochter:
„Schien Sie Gerda hinaus.“ Lud—-
wig legte zärtlich den Arm um seine
Braut und führte sie sjn ein anderes
Zimmer.
Als er mit Frau Baldwin allein
war, begun diese lebhaft: „Es han­
delt sich um ein Diamantenhals­
band!“
„Ah!“ machte der Amerikaner und
pfiff leije durch die Zähne. „Ich
berstehe. Rudolf ist damit durchge--
brannt?“
Frau Baldwin nahm von dieser
Bemertuna keine Notiz. „Ich will
mein Halsband zurück haben!“ sagte
sie in teftigem Tone. „Ich erhielt
es von Gerdas Vater und wollte et
Gerda cls Hochzeitsgeschenk geben.
Sie hei: ten meine Tochter, Ludwig.
Wenn Cie wollen, daß Gerda vor—-
nehm a- ieht, dann suchen Sie Ru—
dolf und sehen Sie zu, daß er das
Haleta herausblle —

Tracey schültelte lächelnd den
Kopf. „Das dürfte keinen Zweck ha­
ben. Ihr Mann ist seit Jahren ver­
schwunden und das Halsband wird
auch längst verschwunden sein. Au—
ßerdem müßte dann die Polizei zu
Hilse kommen. Denken Sie doch
nur an Ihre Kinder!“
„Ich will aber mein Diamanthals­
band wieder haben!“ schrie Frau
Baldwin wie ein ungezogenes Kind.
„O, wie ich diesen Mann hasse! Er
war brutal, schrecklich brutal! Wie
ich ihn überhaupt heiraten konnte —
ich begreife es nicht! Er sagte, er
hätte Geld — er hatte aber keins!“
Sie sprang von ihrem Stuhl auf.
„Eines Tages entdeckte ich — o, es
ist entsetzlich! — daß er schon im
Gefängnis gesessen hatte wegen Ein--
bruchs! Kein Wunder, daß er mir
mein Halsband stahl! Ich will, daß
er verfolgt wird! Er soll seine
Strafe haben! Die ganzen Jahre
däher habe ich nie schlecht von ihm
gesprochen — der Kinder wegen.
Aber ich habe nie vergessen, Ludwig,
wie erbärmlich er an mir handelte!
Er hat mein Geld durchgebracht! Er
hat mich mit meinen Dienstmädchen
betrogen! Er war schlecht — grund­
schlecht — ein Dieb, ein Lügner, ein
Verschwender, ein —“
„Beruhigen Sie sich nur,“ sagte
Tracey besänftigend und führte sie
zu ihrem Stuhl zurück, in den sie
sich warf und bitterlich schluchzte.
„Er ist ein Lump! Ein Schurke!
Lassen Sie ihn laufen — um der
Kinder willen. Hat er Macht über
Ihr Geld?“
„Nein. Ueber mein Geld kann er
nicht verfügen.“
„Na, so eile Sie ihn in Ruhe.
Er hat Sie seit länger als sieben
Jahren verlassen, mithin kann er
nicht so einfach zurückkommen und Ih­
nen Unannehmlichteiten bereiten!“
„Er soll bloß kommen!“ rief Frau
Baldwin mit drohender Gebärde. „Er
so!l bloß kommen! Dann mache ich
ihmn aber die Hölle heiß — dem
Elenden!“ :
„Zie haben doch früher nie so
gesprochen, wie heute, liebe Mutter!“
„Nein,“ versetzte sie schwer atmend.
„Er war sozusagen meinem Gedächt­
nis en!schwunden. Als ich aber neu­
lich sei- Gesicht am Fenster sah, kam
mir ailes wieder in die Erinnerung
— allez, alles! Er soll seine Strafe
triegen — Frau Baldwin packte
Traceyn am Arm. „Er ist ein Ein­
brecher —— hören Sie, ein Einbrecher!
Wenn er nun in mein Haus einbrichi
und mich ermordet? Sie glauben ja
nicht, was für ein Schurke er ist!“
„Sie ießen uns doch immer glau—
ben. er sci sozusagen ein guter Kerl
geweser?“
„Um ter Kinder willen! Darum
scickte auch vorhin Gerda aus
den Z mer. Sie braucht es nicht zu
wissen, vgleich mein zweiter Mann
Gerda gar nichts angeht.“
„Nun, lassen Sie die Dinge, wie
sie nd — um der Kinder willen.“
ein“ entgegnete Frau Baldwin
eln Achend, „wenn ich ihn kriege
d da- Gesetz bestraft ihn nicht,
rnn te ich es selber. Ich trage jetzt
nen geladenen Revolver bei mir.
LWenn er in mein Haus einzudrin­
gen wagt, schieße ich ihn einfach nie­
ner. Jarohl, das tue ich!“
Trarey war erstaunt über die
Veränderung, die mit dieser Frau
vor sich gegangen war. Das sonst so
träge, langweilige, gutmütige Ge—
schöpf hatte sich in eine leidenschaftli—
che, über alle Begriffe rachsüchtige
Furie verwandelt. Traceyh bat sie, ihr
Rudolf Baldwin zu beschreiben, sie
halte es sich aber schon wieder anders
überlegt.
„Nein, ich sage nichts mehr,“ gab
sie schroff zurück. „Vergessen Sie,
was ich Ihnen mitgeteilt. Sie dür—
fen nicht annoncieren. Das Gesetz tut
ihm doch nichts und mein Halsband
ist doch verloren. Aber einen Revol—-
ver trage ich jetzt stets bei mir und
ich schießke ihn nieder, wenn er
tommt.“
„Erx wird nicht wiederkommen!“
„Doch, er kommt! Er war ja schon
da, ich habe ihn genau gesehen. Mein
lautes Schreien hat ihn in die Flucht
gejagt. Das nächste Mal lasse ich ihn
ruhig näherkommen und dann schieße
ich ihn nieder!“ Nachdem sie das ge­
sagt, verwandelte sie sich wieder in
die lässige, träge Frau, die sie sonst
stets war. „Wie heiß es ist!“ sagte sie
nach einer Weile.
Tracey ging ine Gerda zu
holen. Er war so verblüfft über bie
plötzliche Veränderung in Frau Bald—
wins Wesen, daß er nicht umhin
konnte, Gerda zu fragen: „Trinkt
Deine Mutter zuweilen?“
„Nein, Ludwig — gewiß nicht.
Wie kommst Du darauf?“
„Hm — sie ist heute so sonderbar.“
„Irgend etwas muß sie in eine
schrectliche Aufregung versetzt haben,“
erwiderte Gerda hastig. „Was ist
es?“
In diesem Augenblick erschien
Frau Baldwin an der Tür und rief
in scharfenm Tone: „Sagen Sie ihr
nichis. Sei nicht so schrecklich neugie­
rig, Gerda! Das Erscheinen meines
Mannes hat mich in Aufregung ver—
setzt — weiter nichts!“
„Soll Ludwig denn annoncieren?“
fragte Gecda.
s etrntu Nrier
und verließ das Haus. „Ich weiß et­
was viel Besseres.“

Tracey hielt Gerba zurütk.
„Schläfst Du im Zimmer Deiner
Mutter?“ x
„Nein. Warum?“
Weil sie unter einer fixen Idee zu
leiden scheint. Suche es doch unter
irgend einem Vorwand einzurichten,
daß Du die nächsten acht Tage in
ihrem Zimmer schläfst, bis sie die
Rückteht dieses Mannes vergessen
hat. Und wenn Du etwas Sonder—
bares an ihr merkst, so telegraphiere
mir. Ich komme dann sofort.“
In diesem Augenblick rief Frau
Baldwin von der Gartentür her:
„Da kommt Herr Calvert!“
Gerda hatte gerade noch Zeit,
ihrem Verlobten zuzuflüstern:
„Schreibe mir und erkläre mir alles,“
worauf er zurückflüsterte: „Ich darf
nicht — habe zu schweigen verspro—-
chen. Aber gib acht auf Deine Mut—
ter!“
Frau Baldwin stand jetzt mit
Herrn Calvert neben ihnen. Sie er—
zählte dem jungen Mann lang und
breit von ihren vielen Leiden. Tracey
nickte Calvert freundlich zu. Der
junge Schauspieler sah sehr erregt
aus. Dann verabschiedete sich Frau
Baldwin, was ziemlich lange dauer—
te. Endlich fuhr die Droschle, die
draußen gewartet, mit den beiden
Damen davon. Gerda winkte noch
ein Weilchen mit ihrem Taschentuch
zurück, dann gingen die beiden Her—
ren ins Haus.
„Um diese Schwiegermutter kann
ich Sie nicht beneiden,“ begann Cal—
vert.
„Ich an Ihrer Stelle würde es
auch nicht tun. Aber so dumm, wie
sie aussieht, ist diese Frau nicht!“
gab Tracey zurück.
„Dumm? O, dumm sieht sie nicht
aus! Nur entsetzlich träge!“
„Und dennoch ist sie es nicht. Es
steckt noch ziemlich viel Feuer in der
dicken Dame. Man kann was erle—
ben, wenn sich die auf die Hinterbeine
stellt!“
„So? Hat sie sich auf die Hinter­
beine gestellt?“
„Na und ob! Es ist aber Privat­
sache. Hoffentlich kriege ich nicht noch
mit einer anderen Mordgeschichte zu
tun. Eine genügt reichlich!“
„Meinen Sie damit —“ stammel—-
te Arnold.
„Daß sie in der Angelegenheit, die
uns zwei so angelegentlich beschäftigt,
etwas weiß?“ unterbrach ihn der
Ameritaner. „O nein, das nicht. Es
ist etwas anderes. Doch lassen wir
das — es ist doch alles Unsinn!“
„Was ist Unsinn?“
„Wenn Sie noch mehr fragen,
Calvert, werde ich wütend.“
„O, verzeihen Sie,“ sagte der jun­
ge Schauspieler, als er sah, daß der
fonst stets so taltblütige Ameritaner
wirklich erregt war. „Ich vergaß, daß
die Sache privater Natur war.“
„Na — und was gibt's Neues?“
fragte Tracey.
„Das hier!“ Bei diesen Worten
zog Calvert ein Papier aus der Ta—
sche. Es war ein halber Briefbogen
von rosa Farbe und enthielt die
Worte: „Wenn Du das Geld be—
tommst, suche unter dem Kaffeefleck.“
Tracey las und las abermals und
sah Arnold verständnislos an.
„Was ist das?“
„Ein Zettel, den ich heute früh von
Rechtsanwalt Merry erhielt.“
„Befand sich das Papier in einem
Couvert?“
Arnold gab ihm das Couvert, das
er in der Hand hielt. Die Aufschrift
lautete: „Herrn Arnold Calvert“ und
wies dieselbe zierliche Schrift auf wie
der halbe Briefbogen. „Da es von,
Frauenhand geschrieben ist und
Merry es Ihnen gab, nehme ich an,
es stammt von Ihrer Cousine.“
„Ich glaube es auch.“
„Sie glauben es nur? Gab sie das
Papier denn nicht Merry?“
„Nein. Ich ging heute früh zu dem
Rechtsanwalt, um verschiedene
Schriftstücke bezüglich der Erbschaft
einzusehen. Sie mußten den Kasten
mit den Dokumenten vornehmen. Er
ist ziemlich groß und war längere
Zeit nicht ganz ausgeräumt worden.
Als wir in den Papieren kramten,
fiel Merry der Brief in die Hände.
Er gab ihn mir. Merry behauptete,
den Brief nie zuvor gesehen zu ha­
ben; wahrscheinlich legte ihn die arme
Flora eines Tages heimlich in den
Kasten, während ihr Rechtsanwalt
nicht im Zimmer war.“ 2
„Aber warum soll sie das getan
haben?“
„Ja, wenn ich das wüßte! Es ist
mit ebenso rãtselhaft, wie die von ihr
geschriebenen Worte.“
„Konnte Ihnen Merry keine Auf—-
klärung geben?“
Tracey reichte Calvert eine Ziga—
rette. „Rauchen Sie die, während ich
meine Denkmaschine in Gang brin—-
ge,“ sagle er.
„Merrt und ich haben uns heute
vormittag eine Stunde lang die.
Köpfe zerbrochen —
„Aus dem Papier geht deutlich
hervor, daß Frau Brand ahnte, sie
würde ermordet werden,“ unterbrach
ihn der Amerikaner,
Atrnold sprang auf, „Was — was
sagen Sie da?“ ;
„Frau Brand ahnte, daß sie er—
mordet werden würde,“ wiederholte
Tracey nachdrücklich. „Sie schreibt:
„Wenn Du das Geld bekommst“ —
na, Sie konnten das Geld doch erst
kriegen. wenn sie tot war!“

„Washington Journal“, Freitag, den 21. November 1919.

„Freilich — aber was bedeuten
ihre Worte?“
Der Ameritaner legte das Papier
auf sein Knie und sah Calvert mit
seinen großen, klaren Augen an.
„Sie wissen, daß ich hierherzog, um
etwas zu finden, was auf die Spur
des Mörders oder der Mörderin
führt — vielleicht ein Papier, das die
Person, die nach Frau Brands Tod
hier gründlich aufgeräumt hat, ver­
gessen haben konnte. Ich habe überall,
aber auch überall gesucht, leider ohne
Erfolg. Jetzt werden wir nach dem
Kaffeeflecd suchen, und unter dem
Kaffeefleck werden wir sicherlich Pa—
piere finden, die uns Aufllärung ge­
ben. Passen Sie auf, wir stehen vor
der Entdeckung der Wahrheit!“
„Sie glauben, Flora fürchtete, er­
mordet zu werden, und verbarg Auf—
zeichnungen, die auf die Sput ihres
Mörders führen können?“
„Ja, das glaube ich. Und das ar—
me Geschöpf mußte diese List anwen—-
den, damit ihre Aufzeichnungen ja
nicht in die Hände anderer Leute ge—-
rieten.“
„In wessen Hände —“
„Hm — da ist zum Beispiel Boca—
ros, der anfangs ihr Erbe sein soll—
te ——
„Sie glauben doch nicht, daß Bo—
caros um das Verbrechen weiß?“
„Nein, das glaube ich nicht. Er re—
dete zuviel unsinniges Zeug und gab
sich damit sozusagen aus den Hün—
den. Er schwatzte, daß er doch in al—
lernächster Nähe des Tatortes woh—
ne — daß er Frau Brands Erbe sei
— daß er ganz bequem in die Villa
gegangen sein und Frau Brand ge—
tötet haben tönne und daß er sein
Alibi für die Zeit nicht nachweisen
könne. Nein, nein, solches Zeug redet
ein Schuldiger nicht. Ich glaube im—
mer noch, daß eine Frau den Mord
begangen hat — und diese Frau ist
meiner Ansicht nach Frau Feller.
Vielleicht liebte Brand diese Frau
Feller und vielleicht ist daraus die
ganze Tragödie entstanden! Doch
nun genug der Worte. Jetzt heißt es
ans Suchen gehen. Wo zum Kuckuck
mögen die Papiere stecken?“ rief der
Amerikaner und sah sich im Zimmer
um.
„Unter dem Kaffeefleck,“ sagte Ar--
nold und blieb ruhig sitzen. „Statt
im Haus herumzujagen, sollten wir
lieber erst die Möglichkeit erörtern,
wo ein solcher Fleck zu finden ist.
Vor allem käme da wohl ein Tisch­
tuch in Betracht.“
„Ein „weißes“ Tischtuch,“ fügte
Tracey hinzu und setzte sich. „Aber
unter einem Tischtuch verbirgt man
keine Papiere. Ich habe jede Decke
und jedes Tuch in der Wohnung
aufgehoben und umgedreht, aber
nichts gefunden. Zum Fenster brau—
chen Sie nicht hinauszugucken, Cal—
vert, in der Luft ist kein Kaffee­
fleck!“
„Nein,“ gab der junge Mann zu—
rück, „aber vielleicht an der Wand.“
„An der Wand? Na, hören Sie
mal, da müßte ja Brand seiner Frau
eine Tasse Kaffee an den Kopf ge—
rorferheren! Die Wände sind übri—
gens alle tadellos sauber.“
„Haben Sie die Teppiche unter­
sucht?“
„Aufgenommen habe ich sie aller­
dings nicht“
„Ich glaube, die Papiere sind
im Zimmer unter diesem weißen
Teppich verborgen.“
„Warum gerade hier? Der Kaffee—
fler kann ja auch im Wohnzimmer
ein.“
„Nein“, versetzte Arnold und er—
hob sich, „einen Kaffeeflecd sieht
man höchstens auf weißem
Grund“ — er blickte sich forschend
um — „aber ich kann nichts ent—
decken.“
„Eine so peinlich ordnungsliebende
und saubere Frau wie Frau Brand
würde keinen sichtbaren Fleck in ih—
rer Umgebung dulden. Ich schlage
vor, wir rücken mal alle Möbel fort
und nehmen Teppiche und Decken
hoch.“
Calvert fand diesen Vorschlag ganz
gut, und die beiden Herren gingen
unverzüglich ans Werk. Das Piano
wurde weggerückt, aber nichts darun­
ier gefunden. Die verschiedenen
Gardinen und Portieren wurden
gründblich untersucht — umsonst. Ein
Büchergestell wurde entfernt, sämtli—
che Decken und Vorleger wurden zur
Tür hinausbugsiert — nichts. Nach—-
dem alle Gegenstände belseite gerückt
waren, hatten sie den geheimnisvollen
Kaffeefleck noch immer nicht gefun—
den. Jetht kamen sie an eine schwere
Holzsäule, auf welcher eine Büste der
Venus in Gips stand. Die Säule
war in der Nähe des Fensters auf
den Fußboden festgeschraubt und von
weißen Matten umgeben. „Das ist
die lette Möglichteit“, sagte Tracey.
Ein paar Minuten eifriger Arbeit ge­
rügten, um die Säule loszuschrau­
ben. Und unter derselben, durch
den Sockel verdeckt, kam der Kaffee—
flect zum Vorschein, der den schönen,
weißen Teppich verunstaltete. Mit
fieberhafter Eile riß Tracey sein Ta—
schenmesser heraus und löste den
Teppich vom Boden griff mit der
Hand darunter und zog ein dünnes,
grün eingebundenes Büchlein hervor,
auf welchem in goldenen Buchstaben
stand: „Mein Tagebuch“.
„Das wird das Geheimnis lüf—
te!“ sagte er tiefaufatmend mit ern­
stem e ;

17 Kapitel.
Inspeltor Derrick kam mit ziem­
lich niedergeschlagener Miene zu
Walter Feller, um über seine Be—-
mühungen in der Mordsache zu be­
richten.
„Ich habe mein Möglichstes getan,
Herr Feller, tonnte aber nicht das
Geringste entdecken.“
Die beiden Herren saßen im wei—
shen Zimmer. Walter Feller sah
set schlecht aus. Unter seinen
wasserblauen Augen lagen schwarze
Schatten, die auf schlaflose Nächte
deuteten. In dem Zimmer herrschte
cine Atmosphäre wie von Aether, ein
Zeichen, daß Herr Feller Arzneimittel
gebrauchte.
„Der Aufenthalt in diesem Hause
scheint Ihnen auf die Nerven zu ge—-
hen meinte Derrick im Laufe des
Gesprächs.
„Da haben Sie recht. Der Ge—
danke, hier zu leben, wo der entsetz--
liche Mord begangen wurde, ist mir
gräßlich Wir geben die Villa auch
auf und wollen eine Zeitlang auf
Reisen gehen — meiner Frau und
meines Kindes wegen. Es wäre mir
nur lieb, wenn vorher der Mörder
dieser armen Frau entdeckt werden
tönnte.“ 7
„Das wird taum möglich sein, ich
habe mir schon viel Mühe gegeben,“
wandte det Inspektor ein.
„Wenn ich nun eine öffentliche Be—
lohnung aussehe?“
„Auch das wird nichts nüten. Als
ich das weiße Zimmer in Hampstead
entdeckte da glaubte ich wahrhaftig,
eine Spur gefunden zu haben. Der
Mörder muß ein ganz raffinierter
Kerl sein, daß er in jenes Haus ging
undb alle Papiere und Photographien,
die über Frau Brand Auftlärung
geben konnten, vernichtete. Eine Pho­
tographie der ermordeten Frau fand
ich allerdings, aber die nühte mir
nichts. Ja, wenn es ein Bild ihres
Gatten gewesen wäre —
„Wieso? Haben Sie ihren Gatten
im Verdacht?“
„Ja und nein,“ antwortete Der—
rick nachdenklich. „Ich hörte, der
Mann sei kurze Zeit vor Frau
Brands tragischem Tode nach Au—
stralien gereist.“
„In diesem Falle kann er doch
mit dem Verbrechen nichts zu tun
haben.“
„Hm, man kann nicht wissen.
Man kann doch in einer bestimmten
eth „coMgeblich“ nach Australien
fahren, unterwegs umkehren und
heimlich zurücktommen. Uebrigens,
wenn es nicht Brand gewesen ist, der
Papiere, Bücher, Photo—
graphien und dergleichen vernichtete—
wer sonst hätte in das Haus gelangen
tönnen? Und warum vernichtete er
alle Photographien von sich selbst,
wenn es nicht in einer bestimmten
Absicht gefchäh?“
„Ja, das ist ein ebensolches Rät­
sel, wie der Umstand, auf welche
Weise Frau Brand in die Villa Ajarx
tam.“
„Und inbezug auf die nachgemach—
ten Schlüssel zu Ihrer Billa! Ich
tann da nichts heraustkriegen und
doch müssen Nachschlüssel angefertigt
worden sein, sonst hätte der junge
Mann, der mit Miller sprach. einen
solchen nicht verlieren können. Uebri­
gens hörte ich, Herr Calvert habe ei-
Privatdetektivb, einen gewissen
Jascher, mit der Verfolgung der An—
gelegenheit betraut. Na, wo ich
nichts entdeckt habe, wird Jascher auch
nichts entdecken.“
„Ist dieser Jascher ein kluger
Kopf?“
„Nun ja, das scheint er ja zu sein.
Ich habe eine Zeitlang mit ihm zu—
tammen gearbeitet, er scheint nicht
auf den Kopf gefallen zu sein. Aber
dieser Fall wird wohl über seine
Kräfte gehen, wie er über die mei—
nen gegangen ist. Herr Calvert hat
eine Belohnung für Ergreifung des
Mörders ausgesetzt — ich wünschte,
ich könnte sie erringen. Aber die
Aussichten dazu sind miserabel.“
Derrick erhob sich. Walter Fel—-
ler dachte einige Augenblick: nach,
dann trat er an den Schreibtisch
und füllte einen Scheck aus. „Sie
verdienen etwas für Ihre Mühe,“
e er und händigte Derrick den
Scheck ein. „Nur um eins bitte ich
Sie: Geben Sie mir die Photogra­
phie der ermordeten Frau Brand. Ich
habe große Lust, mich der Sache
selbst anzunehmen.“
„O, die tönnen Sie haben,“ ver—-
setzte der Inspektor und steckte den
Schea, für den er sich herzlich be—
dankte, ein. „Es tut mir nur leid,
Ihnen keine besseren Resultate mel—-
den zu können, Herr Feller. Die
Frau ist tot und begraben und die
ganze Geschichte wird bald der Ver­
gessenheit anheimfallen. Es gibt
nur noch eine Möglichleit —“
„Und die wäre?“ unterbrach ihn
Feller.
„Daß Herr Brand plöhlich nach
Hampstead zurücktehrt. Von ihm
unten wir so manches aus Frau
Brands Vergangenheit erfahren; in
ihrer Vergangenheit ist sicherlich der
Schlüssel zu dem rätselhaften Borfall
zu finden.“
„Wenn aber der Mann, wie Sie
vorhin ndeuteten, der Schuldige ist,
dann wird er sich hüten, zuräctzuteh—-
sren“
Da heben Sie recht. Na,
wenn er zurücktemm, so son nir
das als Lrweit seiner Schuldlosia-

keit gelten. Doch nun adieu, Herr
Feller.“
„Wacten Sie einen Augenblick,“
sagte Walter. „Ich komme ein Stück
mit Ihren. Was ich noch fragen
wollte: lassen Sie das Haus in
Hampstead überwachen? Wenn Btand
zutrückkfommt, wird er doch zuerst
torthin gehen.“
„Wenn Sie es wünschen, Herr
Feller, soll das Haus überwacht wer—-
den. Aber das kostet Geld.“
„Die Kosten will ich gern tra—-
gen“, gab Feller zurück. „Ich möchte
nichts, aber auch nichts ungeschehen
lassen, um die Wahrheit zu ergrün—
den. Lassen Sie das Haus überwa­
chen, und wenn de-r Mann zurück­
lommt, teilen Sie es mir mit.“
„Schön, Herr Feller, das soll ge­
schehen.“
Die beiden Herren waren inzwi—
schen bis vor die Haustür gelangt.
Als Feller sie öffnete sah er sich e--—
nem großen Herrn gegenüber, der so
eben tlingeln wellte. „Was wünschen
Sie, mein Herr?“ fragte ihn der
Hausherr.
„Ich mochte gern Frau Feller
in geschäftlicher Angelegenheit spre--
chen,“ sagre Bocaros, denn er war
es.
Herr Feller wintte dem Diener
und beauftragte ihn den Herrn zu
melden. „Meine Fran ist im weißen
Zimmer,/“ fügte er hinzu.
Feller verließ mit dem Inspettor
das Haus und beide gingen im eis­
rigen Gespräch die Achilles Allee hin­
ab !
Wähtrenddessen saß Botraros in
der Halle der Villa Ajax, der Rüc--
tehr des Dieners harrend. Seine
Züge hatten einen verstörten Aus—
druck und er fuhr sich ab und zu
mit der tnochigen Hand über die
Stirn. Das Gesicht Fellers war
ihm so betannt vorgekommen, und
doch wußte er nicht, wo er es schon
ge ehen.
„Aber ich tenne ihn,“ murmelte
der Grieche. „Wo habe ich ihn nur
gesehen?“ Und von neuem zerbrach
er jich den Kopf darüber — aber
vergeblich.
Bald tehrte der Diener zurück mit
der Meldung, Frau Feller erwarte
ihn. Bocaro. folgte dem jungen
Mann die Treppe hinauf in vas wei—
ße Zinmer. Hier saß die Herrin
des Hauses, stoliz und kalt wie eine
Statue. Sie befand sich allein im
Zimmer und war wie gewöhnlich
mit „einer Handarbeit beschäftigt.
Als “ der Professor eiatrat, erhob sie
sich wücdevoll und sah ihn forschend
an.
„In welcher Angelegenheit wün—
schen Sie mich zu sprechen?“ fragte
sie in freundlichem Tone.
Der Professor vecbeugte sich höflich
und nghm den Stuhl an, den sie
ihm bot. Etr hatte Frau Feller nie
zuvor gesehen und fand, daß sie eine
wunderschöne Frau sei, womit er
auch recht hatte. An ihren festgeschlos­
senen Lippen und ihren scharfblicken­
den Augen erkannte er, daß er vo.
einer Frau stand, die unentwegt ein
Ziel verfolgte, wenn sie sich eins ge—
steckt. Fine klrge — eine gefährliche
Frau! Und eine Gegnerin, mit der
zu lämpfen es sich lohnte! Eber er
würde sie besiegen — daran zweiselte
er nicht.
Bocaroẽ antwortete nicht sofort auf
ihre Frage· „Sie sind im Besit mei­
ner Kartte,“ erwiderte er.
„Profesor Hocaros,“ las Frau
Feller von der Karte ab. „Ich habe
nie von Ihnen gehört.“
„Hat Fräulein Mason nie meinen
Namen erwähnt?“
„Ich erinnere mich nicht.“
„Merkwürdig“, sagte er. „Ich bin
Frau Baldwins Mieter.“
„Meine Schwester ist mit der Fa­
milie Baldwin befreundet, aber ich
laube nar daß sit sich für deren
Micier teressiert.“
„Ich wohne in dem kleinen Häus—-
chen am Ende der Wiese in der
Ulyssesstraße.“
„So? Das ist ja sehr interessant,“
gab Frau Feller in artoltilgen To­
ne zurück. „Sie sind Ausländer —
Grieche —“
„Costantin Bocaros — ja, ich
bin ein Grieche“ und mit nachdrück­
licher Betonung fuhr er fort: „Ich
bin ein Covsin der Frau, die in die­
sem Zimmer ermordet wurde!“
Frau Feller zog nur ein ganz
tlein wenig die Augenbrauen zusam­
men. „Sie sind wohl hierhergetom­
men, um Ihre Neugier zu befriedigen
und sich den Schauplath des Mordes
anzusehen? Dort geschah es — dort
neben dem Piano. Bitte, sehen Sie
sich die Stelle an, mein Herr, und
dann verlassen Sie mich!“
Bocaros schritt mit „tühler Frech­
heit“, wie Frau Feller es innerlich
nannte, auf das Instrument zu.
„Sie wissen doch, daß Herr Arnold
Calvert durch den Tod der Ermorde­
ten ein Riesenvermögen geerbt hat?“
fuhr er fort, zu seinem Stuhl zurück­
kehrend.
„Ich hörte es.“
„Und er ist im Begriff, Ihr Fräu—
lein Schwester zu heiraten“.
Jetzt wurde es Frau Feller zu
viel. „Kümmern Sie sich um Ihre
eigenen Angelegenheiten!“ versehte
sie mit schneidender Kälte.
Fortsetzuna folat.)
——— —
— Redeblüte. „W gesagt,
der Bericht, der weder Hand noch Fußz
hatte, fußte auf bloßen Vormutun­
gen. —

:. — -
Washinglouh Dournal.
——— - —“
0
e only German Paper in Washing­
ton. C., Soutnern and Western
Maryland and Northern Virginia.
Published every Fridas Morning.
Ossice, No. 710 Sixth Street, N. W.
Telephone, Main 7789.
Hermann G. Winkler, Proprietor.
Make cheks sor acription payable
to Hermann G. Winkler, 710 Sixth
Street, N. W., Washington, D. C.
Entered as second-class matter August
7, 1915, at the post osee Washington,
D. 0., under the Act of Maroeh 3 1879.
SUBSC RIPTION PRIC ES
Anunaly . .42 50
Semi-Anualy .. 12
Quarterly .. 3 101
Monthly . 45 2:
Single numbers .. .... .05
— — —
ADVKERRTISING RATVES:
One eolumn:
One insertion, one line .... . . 8 15
One insertion, 1 inch, 14 lines . SI.OO
One month, 1 line .... 38 4
One manth, 1 ineh, 14 lines 300
Reduced rates for advertisements ex­
ceeeding 3 inches.
Deutscher Advolat,
508—511 Bond Buildinga,
720 Vierzehnte Straße, N.W.
Lollettionen, gerichtliche und notenische
veschäfte aller Alt, in allen Weltstaalt —
Telephon Main 4619.
Telephon Franklin 1750.3
—
Nic. Wiegand
Anstreicher und Stnckatenr
824 Sechste Srase S.-W.
7
0 —
— *
— 6 —
l r A —
2 2
2 Billiards
Zpieler sind allabendlich willkommen
„Washington Sängerbund“,
314 C Straße, N. W.
Lexxxnuunnnn nnn n n re x vxuur
Alle Arten frische und :
Gerä-. herte Fische. 3
Frische n. geräncherte Bücklinge.?
Frisch geräncherte Aale nnd :
White Fische und Finnan Haddie.
Alles, was im Wasser schwimint.t
und gut zn Essen ist, haben wir.ʒ
7
THOMFORDTã
7
7
: 332 Center Market :
—
177—
ichter
P K nichtei
Uhren, Gold- und Silber-Waren.
Optis.te Artikel.
8061 Neunrte Str. N. W.
Spezialität: Feinste Aus—
führung von aller Art Reparaturen.
hrenreinigen 1.50; Zugfeder 1.50.
Garantie für 1 Jahr.
(Früher mit Schmedtie Bros.)
THOS. S. SERGEON
Leichenbestatter
und Einbalsamierer.
tol Siebente Straße, .Ww.
Celephon Main 1090. Begräbnis Kopell
— Ç þ þÊÏÊSt — —
Frank Geier's Söhne GCo.
N -
Leichenbestatter
ul3 Siebente Straße, N.w.
Telephon UNorth 529.
—
: 1 (30
1 2 754
; / —
I — 590
; — 7e 273
— 1
c —
25 S
MAGAZINE —
; 1
For 4Months!
Just to introduce you to tha worn­
derful New MeCall-, we olsery 1
a four month-' cubecription ftor
ceonte, giving you 4 big numbeis
the best ten-ceut magazine toda-. ;
Great atory writers like Harold
MacCGrath, Louie Joseph Vance,
Eer H. Porter, Jenneite Lao,
th Comfort Mitehell, Mar
de Vorse, 2 Adviee o
ous ekeepins. cookings, noedl
work, Ia ac
dition the famous MeCall Fasnion
* 1
R —— 3—
3 18— 728 5
; e 2

",././0771.tif,
