level_0,index,batch,series,date,ed,seq,sourceFrame,issue,pos,collation,pp,sections,replabel,repnote,height,width,frame,id,text,sourceFile,section
46195,46195,dlc_charitee_ver01,/lccn/sn82014726,1919-12-12,1,8,0798,https://chroniclingamerica.loc.gov/data/batches/dlc_charitee_ver01/data/sn82014726/00517173137/1919121201/1919121201_1.xml,7,8,8,[],,Present,6832.0,5298.0,798.0,https://chroniclingamerica.loc.gov/data/batches/dlc_charitee_ver01/data/sn82014726/00517173137/1919121201/1919121201_1.xml#pageModsBib8,"Wocheurundlchau.
t —
Ausland.
König Viktors Thronrede.
Rom. — König VLiktor Emantel
sagte in seiner Thronrede, das Ver­
fahren und die Sympathie der Na
ton sei für das Parlament, ebenso
wie sür seine Mitarbeit bei allen
Bewegungen zum besten des Volkes
unerläßlich. Italien müsse nach sei­
nem großen Siege alle Anstrengun—
gen auf die Werke des Friedens
richten.
Zu Anfang seiner Rede begrüßte
der König die Helden der Armee und
Marine. Durch den Krieg. juhr er
fort, habe Italien seine natürlichen
Grenzen gewonnen, doch würden
Ziele nicht überall mit Augen
er Gerechtigkeit angesehen. Itali—
ens Ziele im Adriatischen Meer
sind nicht der Mantel für militäri
sche Absichten, und haben meistens
auch keinen wirtschastlichen Wert.
Sie beschränkten sich auf den Schutz
der italienischen Bevölkerung, wel
cher Pflicht und unveräußerliches
Recht Italiens sei.
„Wir hegen keine imperialistischen
Ziele,“ sagte der König, „und beab—
sichtigen in keiner Weise, den Frie—
den Europas zu stören.“
Die Lage in Rußland.
Loundon. — In einer langen Un—
terredung mit dem Kopenhagener
Korrespondenten der „Daily Mail“
erklärte Marxim Litwinoff, Vertre
ter der russischey · Söwiet-Regierung,
Aa absolirt leine
mßerialistischen Ziele und strebe
nicht nach Grenzerweiterung. Das
Sowiet-Ideal ist ein Bund der Völ
ter, die wirtschaftlich und ihrer La
ge nach zu Rußland gehören. Uebe:
die innere Lage in Rußlaud änßer
ten sich Litwinoff, Arbeit werde,
soweit es möglich sei, nationalisiert,
und Löhne würden je nach der Be
schäftigung festgesetzt. Ein jeder dür
fe sich seinen Beruf wählen, sür
Rechtsanwälte tomme aber einc
traurige Zeit, da die alten Gesetze
abgeschaffst seien und es nicht viel
Streit über Eigentum geben könne
da fast alles Eigentum zentralisiert
sei. Der Staat stelle in Strafpro
zessen die Verteidiger.
Land erhalten nur diejenigen,
welche es bearbeiten. Die Erzeug
nisse sind Privateigentum, müssen
— aber an den Staat verkauft wer
den, wobei nach Litwinoff viel un
gesetzliches Profitgrabschen vor—
kommt. Gemeindeländereien läßt
der Staat bearbeiten, um den Bau—
ern zu zeigen, wie es gemacht wer
den kann.
Angriffe der Generale Denikin
und Yudenitsch, sagte Litwinoff, ha
ben die Stärke der Sowietßegie—
rung ungeheuer gesteigert. Admiral
Koltschak zähle beinahe nicht mehr.
Bei jedem Vorrücken des Feindes
wuchs die Begeisterung der Sowiet
Anhänger.
Armeniens Hilferuf.
Gens. — Der internationale Rot
kreuz-Ausschuß hat einen Aufruf an
den Präsidenten Wilson und das
ameritanische Volk erlassen, Arme
nien vor der Vernichtung durch die
Türken zu schützen. Es heißt in den
Aufruf:
„Während des Krieges schien es
den Armeniern, als ob der Tag der
Befreiung nahe. Wie ist jetzt die
Lage verändert! Armenien scheint
vergessen zu sein; die türkische Ar
mee ist wiederhergestellt; der größrtt
Teil des befreit gewesenen Lande—r
ist wieder besetzt; die Armenier kön
nen nicht in ihre Heimat. aus der
sie gewaltsam vertrieben worden,
zurückkehren; Tausende von ihnen
sind Flüchtlinge und leben in Elend
unter der fortwährenden Furcht vot
neuen Metzeleien.
„Wenn die Alliierten nicht ent
jchlossen die Sache der Armenier
aufnehmen, so bedeutet ihre Zukunst
keine bloße Rückkehr unter der Herr--
schaft der Türten, sondern“ die Vol—
lendung des Werkes der Zerstörung
Armenien wird nicht mehr existie
ren, es wird aus der Reihe der
christlichen Nationen ausgetilgt sein.
„In dieser schrecklichen Schict—
salswendung strecken die Armenier
ihre blutenden Hände nach Amerika
um Hilfe aus. Sie wissen, daß ein­
zig Amerika ihnen helfen kann.“
Annäherung zwischen Vatikan und
Frankreich. i
Rom. Unterhandlungen für die
Wiederaufnahme der diplomatischen
Beziehungen zwischen dem Heiligen
Stuhl und Frankreich sind zur Zeit
im Gange.
Die Aussichten für die Wiederher
stellung kfreundlicher Beziehungen
dwischen dem Vatikan und der fran­
zosischen Regierung sind die besten.
Diese Beziehungen wurden seiner­
zeit abgebrochen, als Präsident Lou­
bet im Jahre 1904 dem König von
Dtalien im Quirinal einen Besuch
abstattete. Papst Pius X. protestier­
te dazumals gegen diese Handlung
und erblickte in ihr eine Anerken­
nung des Zustandes, der durch die
— des Kirchenstaates durch
Italien geschaffen worden war.
Dentsche Produkte in Süd-Amerika
Koöln. Daß eine Wiederaufnahme
er Hand lseziehunaen mit südame—

re c
1
;
- —
u
18
1 ;
D
7
i
— ;
19
c
1 : ;
n
c
i y
ei
n
; d
c
b
ge -
t 1
1
8
n
— Q
u
J
&
n.

rikanischen Ländern nur von der
Schnelligleit abhängt, mit der deut--
sche Judustrieerzeugnisse geliefett
werden können und daß dieselben
mit oftenen Armen empfangen wer—
den würden, wird von Herrn Gus—
simann. dem Direktor eines deut—
schen Stahlwerkes, der kürzüich von
Südamerika zurückkehrte, m einem
von ihm verfaßten Artikel in einer
Fachzeitschrift der Stahl- und Eisen--
industrie erklärt. Er sagt darin u. a.
„Deu schland muß jeden Vorteil
dieser großen, dem deutschen Handel
so günstigen Gelegenheit wahrneh­
men. Die deutschen Handelskam—
mern in Südamerika sind bereit,
den deutschen Fabrikanten tatkräftig
beizustehen“
Deutsche Schiffslinien.
Berlin. Nachdem kürzlich die
Hambunrg-Amerika-Linie ihr Aktien--
lapital erhöht hat, um ein Gleichge—
wicht gegen die in ausländischen
Händen befindlichen Aktien zu ha—
ben, ist jetzt auch die Hamburg Süd—
amerika Linie diesen Beispiel ge—
solgt und hat beschlossen, einen neu—
en Attienblock in der Höhe von fünf
Millionen Mark auszugeben. Bei—
de Linien werden gegenseitig die
nenen Aktien austauschen, um ein
Rerbleiben der Aktien in freundli—
chen Händen zu sichern. Der Nord—
deutsche Llond plant jedoch keine
nene Aktienausgabe und zwar weil
man dort der Ansicht ist, daß die Ak—
tien, die vom Ausland gekauft wur­
den, den Weg nach Deutschland zu
rückfinden werden, wenn sie nur zu
spelulativen Zwecken gelanst wor—
den seien.
Boudoi: für Lady Aster.
London. In Erwartung der Lady
Astor als Abgeordnete im Haus der
Gemeinen wurde ein eichengetäfel­
tes Zimmer mit einem Blick auf die
Themse und im Jakobinerstyl einge
richtet, für sie ausgewählt. Man
heißt es jett „Boudoir“. Ss wurde
vor Beginn des Krieges als Teezim—
mer gebaut. WMan wundert sich ob
nicht weibliche Mitglieder der eng
lischen Arbeiterpartei, die noch ins
Parlament einziehen mögen, nicht
an dem Namen „Bondoir“ Ansto?
nehmen mögen.
Amerikanisher Flieger getötet.
Lemberg. Leutnant Edmund P
Graves von Boston, Mitglied det
Kosceiusko Fliegergeschwaders der
polnischen Armee, wurde hier getö
tet, als sein Aeroplan auf das Dach
des Palastes des Grafen Potocki nie
derstürzte, das vom Personal des
Amerikanischen Roten Kreuzes ein
genommen wird.
Die Auswanderung nach Amerika
Koblenz. Die deutschen Zeitungen
beschäftigen sich zur Zeit angelezent
tich mit der Aus-vanderung nach den
LTereinigten Staaten. Die meisten
raten nachdrücklich von der Aus—
wanderung ab Ein typischer Arti—
tel in der „Dresdener Bckerzei—
iung“ gegen die Auswanderün
zußzert sich:
„Das Vaterlaud sieht sich zur
Zeit· der schweren Gefahr gegenübet
daß eut großer Teil des deutschen
Volkes auswandern will, besonder­
nach den Vereinigten Staatë. Je
rer patriotische Deutsche, der sich mit
salchen Plänen trägt, sollte sie auf
geben und auf andere in diesem
Sinne einwirken. Unsere Behörden
hosjen zuversichtlich, daß die Verei—
nigten Stäaten die Aenderung in
Liurandernngegelet machen wer
den, uin die Auswanderung dorthin
sür die Dauer von zwei Jahren zu
verhindern, und damit recht viele
Auswanderungslustige auf diese
Seite des Atlantischen Meeres zu
rütctgehalten werden“
Bismarck's Memoiren.
Berlin. Dr.“ Paul Tesdorp von
München sagt in einer soeben ver
oöfjentlichten Broschüre, daß Fürst
Bismarct kurz vor seinem Bruch mii
dent vormaligen Kaiser Wilhelmn
von hervorragenden Spezialisten
Ausschluß darüber erhielt, daß der—
selbe gehirnleidend sei und daß die
Kranlheit sich in zwei bis drei Jah
ren zum unheilbaren Irrsinun ent
wickeln werde. ;
Wie Dr. Tesdorp sagt, sind diese
Angaben in dem dritten Band der
„Gedanken und Erinnerungen“ des
Fürsten Bismarck enthalten. Das ist
auch der Grund, weshalb die Ver
öfsentlichung des dritten Bande:
unterdrüelt wird. —
Geistliche werden Polizisten.
Fije, Schottland. Bei Gelegenhei:
einer hier abgehaltenen presbyteria
nischer Versammlung wurde mitge—
teilt, daß im westlichen Schottland
viele Geistliche ihren Berus aufge­
ben, da sie mit den geringen Sti­
pendien nicht auskommen klönnen,
und sich um Anstellung als Polizi
sten bewerben.
— ———
2uland.
Der Handel mit Deutschlaud.
Washington. Die Ausfuhr vou
hier nacb Deutschland betrug in den
ersten zehn Monaten des Jahres
852.420,095 Die Circuhr aus
Doeutsthland belief sich auf 84,914.
787. —
Großbrilannien exportierte in der
Zeit vom Waffenstillstand bis zum
L Otktober nach Deutschland Waren

„Washiugton Journal?,

im Werte von über 80,000,000.
Es erhielt deutsche Waren im Werte
von 81,085,000. ;
Von den amerikanischen Exporten
nach Deutschland entfallen $20,603—
521 auf den Monat Okltober. Be­
amte des Handelsdepartements er­
tlärten, daß Großbritannien zwar
den deutschen Haudel im Stürmlauf
ausjgenommen habe, die Vereinigten
Staaten den Engländern aber rasch
den Rang ablausen.
Die amerikanische Aussuhr nach
Südamerika belief sich im Ottober
auf 829,296,045, gegen 17431—
621 im gleichen Monat des Vor
jahres. Argentinien erhielt Waren
im Werte von 313,874,154, fait
dreimal so viel mie im Oktober
1918. Die Ausfuhr nach Brasilien
ist mit 812,279,000 fast um das
sechsfache seit Oktober 1918 gestie­
gen, während der Handel mit Chile
um eine Million zurüekgegangen tiit
und nur noch 83,049,/203 betrug.
Die Einfuhr aus Südamerika nach
hier belief sich auf 68,773,298 aui
Argentinien, 824,171,680 aüf Bra
silien und $5,818,281 auf Chile.
Europa hat mit insgesamt 407—
398,353 in Oktober den groößten
Teil der amerikanischen Ausfuhr er
haiten.
Beraten über industrielle Lage.
Washington. — Hier waren sieb
Zehü in der Geschästswelt und mn
öffentlichen Leben weithin bekannte
Mäuner, die keine besondere Grun:
vertreten, sondern für das Volk als
Ganzes handeln, zusammengekon
men, um über die industrielle Lan
des Landes? zu konserieren. ODre
Koferenz, deren Einbernfung a
20. November voin Weißen Han
angekündigt worden war, bezeichn
den zweiten Versuch des Präsident
Wilson, Mittel zu finden, die cha
tischen Zustände, die seit Monaten
in der Industrie bestanden haben
Ordnung zu bringen.
Für die Zusammenkunft war ke
nerlei Form des Verfahrens vor
geschrieben, und diese wird von d
Konferenz selbst Festgesetzt werden
Fln den Worten Präsident Wilsan
sollte „die neue Konferenz sich bemü
hen, daß unsere Industrien wieder
mit solcher Rücksichtnahme auf G­
rechtigkeit und Billigkeit geleitet wer
den, daß die Arbeitnehmer sich selh
veraanlaßt fühlen werden, ihr Bester
zu leisten, damit der Arbeitgeber
einen ermutigenden Gewinn erzielt
und das Publikum durch keine d
beiden Klassen leidet.“
Die organisierte Arbeit hat rhren
Unbefriedigtscin mit der Zusammen
setzung der Konferenz Ausdruck ge
geben infolge der Tatsache, daß kein
Arbeitnehmer dazu ernannt worden
sind, obgleich, wie sie behaupteten
alle anderen Interessen vertrete:
waren. 1 ;
Nenartige Retrutiernng.
Washington. — Daß man hier
zulande schon zu den vertschiedenen
artigsten Mittelu gegriffen hat, un
die Rekrutierung für alle Branchen
des Militärdienfstes zu fördern
dürfte bekannt sein, aber der Ser
geant Foseph J. For von Philade!
phia ist auf eine Methode verfallen
die trotz Ben Akiba noch nicht dag­
weesu ist. Der Tapfere hat sich näm
lich verpflichtet, 24 Stunden lanz
vor einer hiesigen Rekrutierungssta
tion nnausgesetzt die Tasten eine-
Klaviers zu bearbeiten, um auf die!
etwas ristkante Weise Rekruten an
zulocken, wobei er nicht mal währenr
der Einnahme seiner Mahlzeiten
Pause mache' wird. Forx bezeichnel
seine Dauerpaukerei optimistisch ini:
Klavierspiel und sicherlich dürften
Rekruten, die imstande sind, sie sit
24 Stunden lang anzuhören, ohn
entsetzt davonzulaufen, tapfere Sotl
daten von der Sorte abgeben, mit
denen man den Teufel aus de
Hölle holen kann.
Regierungobetrieb geht zu Ende.
Louisville, Ky — Hiesige Bahn
Agenten empfingen von der Bah:
Administration die Order, die Aus
gabe von Durchgangs Frachtbriefen
ren, bis auf wenige Ausnahmen
ganz einzustellen Diese Art Fracht
briefe waren am 1. Mai 1918 unter
dem Regierungsbetrieb in Kraft ge
treten und ersparten den Bahnen
eine Monge Arbeit. Infolge Auif
hebung dieser Art Frachtbriefe wird
die Anstelling einer Menge Clerts
in den Bureaus der großen Eisen
bahn-Zentren notwendig gemacht.
dn Eisenbahnkreisen wurde der Er
laß dieser Order als der erste Schritt
der Bahn Administration für Rück
gabe der Bahnen in Bahnbetried
angesehen.
Bekannter Deutscher gestorben.
Cincinuati. — Dr. Alos
Fuettner, ein bekannter angesehencr
Arzt und Bürger, ist den Folgen
eines Schlagansfalles erlegen. Er
wurde vor 70 JFahren in Breslan
geboren, tam 1884 nach Cincinnati.
wurde Redakteur des „Wahrheits­
frennd“ und gründete dann selber
eine klatholische Wochenzeitung, die
jedoch keinen langen Bestand hatte
dut Soniner 1887 trat er als
Hilfs Redatkteur beim „Vollsblatt“
ein, redigierte nebenbei die „Krieger­
zeitung“ und nahm auch seine, be­
reits in der alten Heimat begonme·
nen ärgtlichen Studien wieder auf.

1890 ließ er sich als Arzt nieder und
alte sich durc, seine Tüchtigkeit und
issenhastigkeit eine lohnende Pra—
ris aufgebaut.
Wolldecken für F 8.35.
Washington. — Tausende von
Decken aus reiner Wolle werden vom
Navy Department zum Kostenpreis,
nämlich 38.35, verkauft werden. Zu—
nächst wurden die Mayors von 150
Städten ösllich des Felsengebirges
benachrichtigt und aufgefordert, Be­
stellungen von Einzelnen, Firmen
und Körperschaften zu übermitteln
Es werden aber auch Bestellungen
von-überall innerhalb der angegebe­
nen Zone angenommen. Sie sind
an Lientnant Commander Conger,
Navy Hard, Norfolk, Virginia, zu
richten. Denen von Einzelnen und
Firimen ist der Kaufbetrag und
Porto für 5 Pfund-Paket beizule—
Jgen Körperschaften müssen eine die
Bezahlung innerhalb 30 Tagen ga­
rantierende Beglaubigung des Ma­
yors mitschicken.
Höhere Löhne für Schlachthaus-
Helfer.
Chicago. — Die in den großen
Schlachthäusern in Chiceago, Kansas
City, St. Lonis, Denver, Omaha
und anderen Städten des Westens
beschäftigten Handlanger erhalten
laut Schiedsspruch des Bundesrich­
ters Samnel Altschuler eine Lohn—-
erhöhung von etwa 10 Prozent. Die
Lohnerhöhung trat am 1. Septem—
ber 1919 in Kraft und etwa 75
Prozent aller Schlachthaus-Angestell­
ten wurden dadurch berührt.
Mobausschreitnungen in Kanada.
Kitchener, Ont. — Alderman
Bitzer wurde von einem Mob, der
ihm sein angebliches unpatriotisches
Verhalten im Stadtratssaale vor­
warf, gezwungen, den Union Jack
zu küssen und darauf viermal im
See im Victoriapark untergetaucht.
Später bemächtigte sich der Mob W
D. Eulers, M. P., den sie in die
Klubräume der Great War Vete­
rans Assoeiation brachten und ver—
langten, daß er die Flagge küsse und
bei den zurückgekehrten Soldaten
wegen angeblicher unpatriotischer
Aeußerungen Abbitte leiste. Dr.
Euler weigerte sich und wurde bis
zur Bewußtlosigkeit geschlagen.
Ein Scheidungs-Rekord.
Atlanta, Ga. — In den beiden
Abteilungë, der Superior Court
wurden über 100 Ehescheidungen
erledigt, womit ein Rekord gescha?-
fen wurde. Ueber 400 Cheschei­
dungsgesuche sind noch zu erledigen.
Die Gesetze von Georgia verlangen
ein zweimaliges Urteil, mit eineimn
dazwischenliegenden Zeitraume, ehe
die endgültige Scheidnng bewilligt
wird.
Neger gelyncht.
Macon, Ga. — In der Nähe
dieser Stadt wurde ein unbekannter
sarbiger Mann gelyncht, nachdem er
Hansel Rosier jr., den Sohn eines
Farmers, geschossen und schwer ver­
wundet hatte.
Der Mob arbeitete so ruhig, daß
vie Nachbarschaft vom Lynchen erst
dann erfuhr, als man die Leiche des
Opfers, von einem Baume in der
Nähe einer Kirche herabhängend, ent­
deckte. ;
Mädchenleiche im Koffer..
Lawton, Mich. — In einem al­
ten Koffer, der im Keller ihrer Woh—
nung unter einem Haufen von
Schindeln gefunden wurde, einge­
zwängt, wurde die Leiche einer
Fra gefunden, die man für Maud
Täbor, seit etwa drei Jahren ver­
mißt, hält. Der Fund wurde von
ihrer Schwester, Florenee Tavor
Critchlow, gemacht.
Das vermißte Mädchen war die
Tochter des verstorbenen angesehe­
nen Rechtsanwalts Lester Tabor. Die
Mutter und ein Bruder sollen im
Westen leben, von wo einige Mo--
nate nach ihrem Verschwinden ge­
meldet wurde, daß sie ausf einer
Ranch gestorben sei. Sie war eine
Graduantin der Universität von
Michigan und Lehrerein fremder
Sprachen. :
Noble Banditen.
Omaha. — Banditen sprengten
den Geldschrank im Laden von Hay­
den Bros., nachdem sie die zwei
Nachtwächter gebunden und gekne—-
belt hatten, und entkamen mit einer
Beute von 363,000 in baren Gelde
und Wertpapieren. Vorher nah—
men sie im Grocery-Departeiment des
Ladens eine fröhliche Mahlzeit ein.
sangen und tanzten den Nachtwäch—-
tern etwas vor und gaben schließlich
sedem für seine Mühe· 20 Trint
geld.
Gabenschiff gesunken.
New Hork. Der amerikanische
Dampfer „Kerwood“, von New
York nach Hamburg bestinunt, der,
am 1. Dezember in der Nordsee auf
eine Mine lief, ist „in die Lust ge—
sprengt und gesunken.“ Die Veann­
schast wurde gerettet. -
Die Reeder nehmen an, dahß das
Schiff völlig verloren ist. Seine La—
dung bestand zu großem Teil aus
Nahrungsmitteln und Vorräten, die
von Amerikanern an ihre Verwand­
ten in liin gesandt wurden.
Der Dampfer, 651 Tonnen groß
war früher unter Tenen en
Flagge. 1—

M Vereins-Kalender
Die Herren Sekretäre sind gebeten,
uns stets von Adressenveränderungen
owie von Vorgängen in ihren Verei—
nen Bericht zu geben, und sind wir
tets bestrebt, solche an geeigneter
Ztelle aufzunehmen.
NPreis für die Insertion der Kar
e 82.50 pro Zahr.
Dentscher Waisenhansverein. Prä
sident Martin Wiegand; Sekretär:
Hermann G. Winkler, 710 Sechste
Straße, N. -W. Direktoren-Vers. am
2. Sonntag i. M
Ruppert Home Franen Hilfsver­
ein. Präsidentin: Frau M. DeGrain:
Setẽretärin: Frau B. Krumtke; Verjs.
am 2. Dienstag i. M.3 Uhr nach
nittags im Ruppert Home.
Prospect Hill Cemetery. Wm.
Stiebling, Präsident; Wm. Martin,
Sekretär; Chas. HBrickwedde, Schat;-
meister. Vers. am 1. Freitag i. M.
in 822 9te Str. N. W.
e
7— ;
Gesang - Vereine.
Washington Sängerbund, 314 C
Str. N W. Martin Wiegand, Präs.
Adoli Brauner., Sekretär, 314 C
Str. N. -W. Direktoren-Vers. am 2.
Dienstag i. M
Germania Männerchor, 922 Pa.
sve· NW. Präsident: John Reif;
Sekretär: Fritz Häffner, 1050 Bla—
densburg Road, N. E. Versamm—
slung am 1. Donnerstag i. M.
Sängerbund Damenvereiy Ve-rs
am 2. Mittwoch i. M., abends 8 Uht.
m Sängerbund.
Arion Damenverein. Frau N.
Krumtke, Präs. Vers. am 2. Mittwerh
i. M. abends 8 Uhr.
Dentsche Freimanrer Lrge
»— Arminins, Nr. 25, F. A. A.M
Adam Sthneider, Sekretäc
1 Uaion Savings Ban? Building.
Lers. am 1. und 3. Dienstag i. N.
m Nenen Masonic Tempel.
Landsmannschaftliche nund Unterstüt
unngs - Vereine.
Verein Baden. Vers. am 2. Mitt
woch i. Min 922 Pa. Ave. NW.
Zakob Wirz. Serroetär 1250 Half
Str. S-E.
Amerifanischer Unterstütznugs-
Verein. I. F. Kelle, Präsidenr; Nic
Wiegand, Sekretär, 824 vte Straße
W dTel Main 2999 m Verl.
am 2. Dienstaß . M. in 622 Va.
Ave., S -W.
Hessendarmstädter Unterstützunas-
Lerein Emil Spahn, Präs.; John
Meininger, Sekretr., 1120 Achte
Str N E Vers Nittwech i. M.
n 922 Pa. Ave. N .
Schwübischer Kranken - Unteritüt
augsverein. Michael Dietz, Sckretr
Mt Nainer, MNd DPers am l.
Dienstar MN in No 4 C
Str. NW.
Pattdentscher Vercen, Washinnton,
d. C. Sekretär: Wmn Stuermann
17 Chestint Str., Taloma Park, D·t
beri. cm 1. Domnwerstag i. e. im
Sängerbund.
Nnterstütungs-Bunnd, Distrikt No.
160. Mich Dietz, Sekretär, Mt. Rai—
nier, Md. Vers. am 4. Dienstag i.
N. in No. 922 Pa. Ave., N.W.
„Woshington Metzger Unterstütz­
ings-Verein“. Präsident: Stephan
Frank, 200 Sechste Str. S. E. Sekre­
är: Aritz Hes; 112 Ate Etr NE
rer' am l. Dienstag i MVin 822
La. itce. N. W.
Wiitzelm Tell Unterstütznngs-Ge­
sellschaft. Vers. am 3. Morrtag i. M.
in 922 Pa. Ave. N -W. Vul Bach­
“hmidt, Sekretär. 907 23 Straße
Nordwefst
Onkel Bräüsig Vergnügungsverein
Vers. am 2. Dienstag i. M. im Sän
gerbund. Geo Meir, Sekretär. 1331
Erste Str. NW.
1
.7 ae — —llh 8.
—
— a — —
2 Kegelbahnen
allabendlich frei. -
Kegler sind freundlichst zum Besuch
eingeladen.
„Washington Sängerbund“,
314 C Straße, N.-W.
A 4 4 4 4 4
Empsehle mich den geehrten Le—
seru des Jon uals für alle norkom—
menden Schreinerei Arleiten jund
damit verbundenen Rearaturen.
4114 —K STRASSH. N. V.
r 2

;ra 4 2 ;
; 2— R Bei uns
: ; : — :..; 1.; -
de Gereinigte Kleider ;
- - — sind immer so gereinigt, wie sie -
- ! sein sollten. ;
* / —? Wenn Jlhre Kleider bei uns ge-3
24 4 2 L reinigt worden sind, dann kön—
- AMlh 1 nen Sie versichert sein, daß selbi—
0/ ge auch rein sind.
7 M— M M ; e Rreit
10 j s Ij 2 1 Zeitgemäße Preise.
u
- —— : 8 bequem erreichoende
- u Zweigstellon mit Phones.
; The Hoffman Company, Inc.
; CLEANERS & DYERS ;
MAIN OFFICE 735 THIRTEENTH S 7. N.W. MAaiN 10056
e 44
Spezial-Agent der
Union Central Lise Insurance Co.
Cincinnati, Ohio.
401 —4OB Union Savings Bank Bldg. Tel. M 9936;
; r Ic SI 1
Bezuhlt 7— 2 2 —
wie es / 7 — m ; 1 ;
; Ench 1; — 1 L— ; 4 ; o— 3
vosjt! ;
Verbannen Sie jeden Gedanken, daß Sie
Sehmerzen erleiden, wenn Sie uns besachen.
ü Unser Stab von erfahrenen Zahnärzten steht in deren Beruf vorn
; an. Jedes ölnstrument, das die Zahnheilkunde kennt, steht ihnen
1 zur Verfügung und hilft ihnen, ihre Arbeit zu verrichten, ohne je— q
; doch Shmerzen zu erregen. Warten Sie nicht bis morgen, sehen
; Fie uns heute; Trotzdem unsere Preise sehr mäßig sind, garan­
-8 tieren wir jede Arbeit, die wir verrichten.
; Ein Gebiß $5.00 aufwärts. Goldsüllungen 75e an.
8 Goldkronen per Zahn 83, $4, $5. Silberfüllungen 50c an.
77 QO Painl
1 ; ; ainless
; DR. SMITH DENTISTS Dentists
Ecke Siebente nnd E Straße, N- W. Eingang 434 7te Straßse.
8 Veber Kresge's ʒc and ide Store. Auskunft Second Natl. Bank. Damen-Bedienune, -
oten vons his- Utr abends. Soontacs - Uhr. Fillale: 201 Park Avenuo, Baltimore, Md. 1
— —
: —
—
Schweinefleisch-Produkte
—
Die größte Reinlichleit herrscht in „2 —
unserem Etallissentent. Wir sehen da-- 1702 — —
rauf, daß; auch bei den Farmern, von — 2420 u -
denen wir die schönen, fetten Schwei- „ 3— 2
ne beziehen, dieselbe Reinlichkeit vor- 2 — 2 —
handen ist. —— ——
— Berkshire Hill Wurstfreisß — —— 1—
Brat- und Leberwürste! — r
Wiener-, Frunkfurter- u. Mettwurst, n
Meat Loaf, Lunch Rolls, Schiuken, m N hul hll
Corued Beef, Frisches, gesalzenes u. M
geräuchertes Fleisch! 2 MII
22 — ;
626 D str s.w. —
; /2 — — /
und in — — ——
allen Märkten. : — 914
——
Telephon: ; 1 Mtr s 2A
Nain 4630.
HIGH CLASS PRINTING
HIGH CLASS PRINTI
- -
Try us on that next order
for Labels, Billheads, Carũs,
Letterheads or Envelopes.
OCur prices are rignt and s is ur vworl
which is alvwaxs delivered on time
2 ;
Washington Journal 710 sixth Btr,. N.·W.

3 Verlangen Sie das Beste, das —
3 gemacht werden kann und das ist ;
M. HOLZBEIERLEINS
o 1
erihmtes Brod und Kuth
berihmtes Brod und Kuchen
Allerlei Sorten.
. Spezieller Fruchtkuchen und „pound cakle“
—nur das Beste und Schmackhasteste. ;
Zu erhalten im ;
Center Markt. Nordost Markt.
Liberty Markt. Südost Markt
Alexaudrï Martkt
- /
— — —2-2— 23 — 2 —— 2 —l—— — —— /

",././0798.tif,
