level_0,index,batch,series,date,ed,seq,sourceFrame,issue,pos,collation,pp,sections,replabel,repnote,height,width,frame,id,text,sourceFile,section
2989,2989,dlc_charitee_ver01,/lccn/sn82014726,1919-11-14,1,1,0759,https://chroniclingamerica.loc.gov/data/batches/dlc_charitee_ver01/data/sn82014726/00517173137/1919111401/1919111401_1.xml,0,8,8,[],,Present,6820.0,5336.0,759.0,https://chroniclingamerica.loc.gov/data/batches/dlc_charitee_ver01/data/sn82014726/00517173137/1919111401/1919111401_1.xml#pageModsBib1,"Published and dislribuled under jtin bo. 167 authorized by tho Aet of detobor 6, 1917, on filo at tho Posĩ Ossico of Washingion, D.. fy postmaster bonora

Osfizielles Organ der deulsehen Gesellsehafls-, Wereins- und Kirehenkreise im Distriel GColumbia

60., Jahrgang. No. 46— Einzelnnummer 5 Cts. —52.50 per Jahr.

Wochen-Rundschau.
Zu seinem Besuch in Washington
hat sich der Prinz von Wales etwas
nicht bestellt, nd das ist „Kaiserwet
ter,“ denn es war ein ausgesprochen
unfreundlicher Tag, regnerisch und
dabei schwül, an dem der Gast des
Landes hier seinen Einzug hielt. Viel
ist über den Besuch noch nicht zu schrei­
ben, zumal der offigieille Bericht dar
über so wie so in die Zeitungen gehen
wird. Der Besuch des Prinzen for—
dert natürlich einen Vergleich mit dem
heraus, den sein Großvater im Jahre
1860 hier abstattete. Das offizielle
Ceremoniell wird auch da, wenn auch
die Personen gewechselt haben, doch
imn großen und ganzen dasselbe sein
nur in einem nicht. Als Edward dei
Siebente damals auf dem alten veuri—
more und Ohio Bahnhofe hier rin—
traf, da gehörte zu der vom Staats—
sckretär geführten Empfangsgesell­
schaft auch der Bürgermeister von
Washington. Das klingt wie ein
Märchen: Bürgermeister von Wash—
gton. Ja, dainals gab es noch ei—
en Mann, der sich dieses Titels rüh—
men konnte, damals hatten wir so et—
was wie Selbstverwaltung, damals
konnten wir in gewissem Maaße un
seren eigenen Uedeln selber abhel—
fen, damals hatten wir noch nicht das
Undemokratischste, das es giebt:
Taxation without Representation
Besteuerung ohne Vertretung in der
besteuernden Körperschaft. Hätten
wir heute eine Stadtvertretung, in
der Vertreter der Bürgerschaft säßen.
wie vieles würde doch besser! Solch­
schreienden Uebelstände, wie unser
Straßenbahnsystem, wie die schreckliche
Schiulnl wären wohl nicht da. Aber
das liegt natitelich an dem System
Man kann ja auch schließlich von
Müännern, die hierher in den Kongreß
geschickt werden, nicht erwarten, daß
sie ein Herz, ja, daß sie wenigsten-
Verständnis hätten für die Stadt in
der sie fremd sind, deren Lebensnöte
und Lebensbedingungen ihnen abso—
lut unbekannt sind. Die Einwohner
Washingtons, die ihre Kinder in die
hiesigen Schulen schicken, die an ih—
rem eignen Fleisch und Blut erfah—
ren, wie schreiend derMangel an Leh
rern und Lehrräumen ist, stehen mit
gebundenen Händen dabei, sie haben
uichts zu sagen, viel weniger können
sie Abhülfe schaffen. Diese Hülse liegt
beim Kongreß, aber — es ist ein lan
ger, langer Weg nach Tipperary. Die,
wenigsten dieser Mitglieder des Kon
gresses haben ihre Kinder hier, was
scheniert sie die Not Washingtons, das
in jeder Beziehung ihr Stiefkind ist
In den ösfentlichen Schulen giebt es
gegenwärtig 280 Klassen, die über—
süllt sind. Die Folge davon ist, daß
die Lehrer und Lehrerïnen über
bürdet sind, daß ihre Wirksamkeit
brech gelegt wird. Ein großer Teil
der Lehrer ist unter der nervösen An—
spannung zusammengebrochen, wo—
durch natürlich die erfolgreiche Arbeit
der anderen, die schon überlastet sind
und nun noch die Arbeit der erkrank
ten Kollegen übernehmen müssen,
noch biel mehr in Frage gestellt wird.
Nicht weniger als 132 neue Lehrstel
len sind notwendig. Um die Schaf—
sung dieser ist der Kongreß ersucht
worden. Bewilligt er sie, dann kön
nen Halbetag-Klassen gebildet wer
den, und die einzelnen Lehrer werden
nicht übermäßig angestrengt. Da
sind 77 Klassen, in denen mehr als
50 Schüler sitzen, 122 Klassen, in de—
nen die Schülerzahl bis auf 48 geht,
und in 80 Klassen erreicht sie die Zahl
45. In keiner Klasse sollten mehr
als 40 Schüler sein, und es ist nicht
redlich gehandelt, ein Kind in eine

Versammlnngen in der kommenden
Wache:
7 ——
Montag:
„Wilhelm Tell Unterstützungs Gr­
sellschaft“; in 922 Pa. Ave. N. W.
Dienstag: ;
„Arminius Loge No. 25“, F. A.
A. M.; im New Masonie Tempel,
18te Str. und New York Ave.
Columbia Brauer Kranken Unter—
stützungs-Verein; 922 Pa. Ave N.W.
Mittwoch:
„Hessendarmstädter Unterstützungs-
Berein“; in 922 Pa. Avenue NW.

—— — — —— — —— — —
—— ì —— — ———ì
;;2 — ;
; - - 2
— — — m — — ——
L - — —;—— — -
: - - ——— M ——— —ll A
—— , :—— —— — N 7— — 2 -
4 ——— N —— 2 —
; - 0— 7 .. 72 ;
7 7 — : — 1M E7 —-— 77 7 1 —“ 4
q — I—— —
4 — — 41— ;
—— —— — ;
; ; — woehen Blat
d2—— — : 2

—Das Unternehmen, deutsche O—
pern im Lexington Thecter in New
York aufzuführen, hat vorläufig ein
klägliches Ende genommen. Das
Ohergericht des Staates New HYork
hat entschieden, daß Opern in deut­
scher Sprache erst nach dem Friedens­
schluß zur Aufführung gelangen dür­
fen. Die Geschäftsleitung des Thea—
ters machte gleich nach dem Erlaß die—
ser Entscheidung bekannt, daß deutsche
Opern in ænglischer Sprache gegeben
werden.
—Viele unserer geschätzten Leser
bekoömmen Nachrichten aus der alten
Heimat, worin der Ausdruck „Auf—
geld“ (das gewöhnlich bei Empfang
von Paketen zu entrichten ist) ge—
braucht wird. Dank einer Zuschrift
der Frau Scharbau sind wir heute
in der Lage, unsere Leser üher den
Ausẽdruck aufzuklären. Der Zoll an
und für sich soll nicht so hoch sein, aber
— und nun kommt der Haken — er
muß in Gold berappt werden. Gold
ist aber ein sehr rarer Artikel, und da
die wenigsten es haben, müssen sie die
Differenz zwischen Gold- und Silber­
kurs ausgleichen, mit anderen Wor—
ten; sie müssen auf ihre Silberzahlung
so viel „Aufgeld“ zahlen, wie nötig
ist, um den Goldkurz zu erreichen.
Will man ihnen also diese Mehraus—-
gabe — das Aufgeld oder der Auf­
schlag beträgt,/ 4225 Prözent — erspa—
ren, dann empfiehlt es sich, neben dem
Patet noch einen eingeschriebenen
Brief mit I—2 Dollars Einlage zu
schicken. Getragene Kleider werden
hier nicht mehr, zum Versand ange—
nommen, es sei denn, daß man einen
Erlaubnisschein vorweisen kann.
Dieser Erlaubnisschein ist aus Berlin
zu beziehen. Die Adresse, wo man ihn
erhalten kann, erfährt man auf den
hiesigen Postämt 7
Alle Sorten kalter Aufschnitt,
; Gekochten Schinken,
Bühlers, 36—5 Riggs Markt.
Klasse zu stecken, das mehr als diese
Anzahl Schüler hat. Die Schulbe—
hörden versuchen alles, die Situation
zu mildern, aber was können sie tun,
wo sie dem Mangel an Raum und an
Lehrern mit gebundenen Händen ge—
genüberstehen. Ebenso wie in den
Volksschulen sieht es in den Hochschu—
len aus. Wenn die Hochschüler an
gemessene Belehrung empfangen sor
len, dänn sollte der Hochschullehrer
nicht mehr als vier Lehrstunden zu
geben haben. Jett aber ist er ge—
zwungen, fünf, ja sogar sechs zu er—
ieilen. Daß derartige Zustände den
Schüler beeinträchtigen, indem der
übermäßig angestrengte Lehrer nicht
seinẽ ganze Frische hergeben kann,
ciegt für jeden vernünftigen Menschen
klar auf der Hand. Der Beruf de-
Lehrers kann nicht mit dem des Ge—
schäftsmannes verglichen werden.
Der Geschäftsmann kann ein Ge—
schäft, das über seine Leistungsfähig­
keit geht, von der Hand weisen, der
Lehrer kann das nicht tun; denn für
jedes Kind, das das schulpflichtige
Alter hat, muß eben gesorgt werden.
Hoffentlich kommen die Herren im
Kongreß zu dieser Erkenntnis.
Und da wir nun wieder einmal
bei den Herren vom Kongreß ange­
langt sind, möchten wir auch ihre lie—
benswürdigen Seiten betrachten, na—
mentlich, was man sich Lustiges von
ihnen erzählt. Der frühere Senator
Hardwick von Georgia war ein sehr
kleiner Mann. Eines Tages, als die
Session und damit auch sein Termin
zu Ende ging, eilte er nach der Haus—
seite des Kapitols um noch einige Ge—
schäfte zu erledigen. Er hatte dabei
eine unendlich lange Cigarre im
Munde. Auf seinem Gange traf er
in der Rotunda auf eine Menschen­
menge, die den Worten des Führers
andächtig lauschte und ihm dabei den
Weg versperrte. Er drängte sich durch
konnte aber einen großen Mann nicht
bei Seite schieben. Letzterer guckte
endlich über die Schulter und sprang,
als er die Riesenzigarre erblickte,
schleunigst ee Wege. In diesem
Augenblick kam Senator Williams
des Weges und wurde von dem Be—
sucher des Kapitols gefragt, wer denn
der kleine Mann gewesen sei. Auf
die Antwort, es sei Senator Hard—
wick, bemerkte der Riese: Es ist mir
einerlei, wer es gewesen ist, wenn er
aber mit seiner Cigarre im Murße
durch eine Menschenmenge sich drängt.
dann sollte er vorsichtig sein, daß er
ihnen nicht die Rockschöße verbrennt.

1
j 777— 27— ——
2
S Zum Ausschneiden!
;
7 ; ;
8 Die deutsche S
8 e Spratche.
- Von I. Kieschnick.
S Noch dürft ihr zu den Toten sie nicht legen,
- Ob es euch auch darnach gelüsten mag;
V Noch weiß sie frisch und kräftig sich zu regen,
Noch wissen wir sie nach Gebühr zu heben,
S Die edle Deutsche, unsre Muttersprach!
* „Und diese Sprache, sie wird niemals sterben;
S So wie ihr Wohllaut nimmermehr vergeht;
8 In ihrer Schönheit, ihrer keuschen herben,
S So lange dieser Erdenball besteht,
- Durch Haß, Verfolgung könnt' Ihr sie nicht töten:
7—
F Sie ist ja voller Kraft und Lebensmark,
Und sie erstarkte nicht in Leid und Nöten;
Neu wird sich ihr nun bald ein Morgen röthen
- Anstatt zu sterben, wird sie riesenstark.
- D'rum lasset euer Hasten und Bemühen,
- Die deutsche Sprache sargt ihr nimmer ein;
Wenn erst vorbei die dunklen Wolken ziehen, ;
Dann wird sie herrlicher noch hier erblühen,
- uönd hoch geehrt geachtet wird sie sein.
a
;
i
rr m m men
e
;
S Zum Ausschneiden! 8
3 —
—;— ; ; 8
— Germanenart lebt wieder auf! S
n—— — -
— Von A. Friedrich Sterger.
S Sie wußten selbst nicht wie es kam, -
S Als Nachbarn wohnten sie beisammen; S
Doch heimlich hatten sie viel Gram, S
3 Da loderten des Neides Flammen. 2
— Mißtrxauen ist halt böse Saat, ; 5
Sie wucherte auf jedem Psad; ; ; S
Vie alte Freundschaft war gewichen, ; -
2 Die Mißgunst hatt sich eingeschlichen.
- c : -
Man grüßte sich, wie es halt Braucl 2
09: „ 8
Die Vettern reichten sich die Hände; -
D Doch alles roch nach Pulverrauch.
Als hätt das Vetterntum ein Ende. S
2 ver Satan schlich ganz leis' herein,
S „Warum soll immer Friede sein?“ ;
on heimlich hetzte er die Schergen
— m seinen Blutplan zu verbergen. 2
2 Dem deutschen Volk war längst er gram — 2
Dort hat man ihm den Schwanz zertreten;
So brütete er sonder Scham
Des Neides giftgetränkte Fäden. 7
Das „Gott mit uns“ gefiel ihm nicht
8 Des deutschen Volkes Krast und Licht
Lag schwer auf seinem Teufelsherzen, 2
2 Nicht länger lkonnte ers verschmerzen. S
- —
S C t schürte da und schürte dort — — ;
S Nit Voildampf sollte es gelingen;
Da griff er gar zum Meuchelmord
Um jeinen Blutplan zu erzwingen. 2
Manch Werkzeug hat er mürbgehett, -
— Da ward geschliffen und gehetzt — S
S Als ob die Welt ein Tollhaus wäre, S
S Ganz ohne Scham und ohne Chre!
D Als 61 D ia4 F ; 2
Als ob ein Donnerschlag sie traf, 2
3 So zuckten jäh die deutschen Gauen;
: Noch lag die Welt im tiefen Schlaf, S
Es war des Sommers WMorgengrauen. ; 2
Die Erntezeit stand schon bevor,
Die Flur bedc-: vom Blumenfslor;
5 Dn drang ein Angstschrei durch die Lande, -
Als stünd' die Welt im Feuerbrande. 8
2
8; e Deutiglen? griff zu seiner Wehr — 2
Kaum onnt' man Freund und Feind erkennen;
Ein Ruf erscholl vomn Fels zum Meer en 2
3: 2 ! — 1 L —
ie Alpenfirnen sah man brennen. -
Behüt dich Gott, du deutsches Land,
Schutlos stehst du im Weltenbrand!
3 Die deine guten Nachbarn waren S
3 Wie Räuber kommen sie gesahren.
0
S Sie wußten selbst nicht, wie es kam — S
D Die lieben Vettern, sammt den Basen;
D Nun sah man sie ohn Ehr' und Scham
5 Als sie gen Deutschland Sturm geblasen! F
Nui Teufel — ——
Ein Schuft, wie keiner seinesgleichen; 2
8 Der brüstet sich so ehrenreich
- - Und will die ganze Welt erweichen! S
- — 2
Nun warte, bis der Tag erscheint — S
S Noch steht das „Gott mit uns“ hoch oben:
2 Und wär' die ganze Welt versteint, 2
Germanenblut wird man noch loben. S
27 Es kommt die Zeit, Gott steh' uns bei — S
Geduldig muß man sich fassen;
Gerul ; Isich noch fassen;
S Das „Gott mit uns“ wird wieder frei,
S Germanenkrast kann nicht verblassen.
—-— ; 2
EI e ededo

Freitag, den 14. November 1919.

Neue Postverordnungen!
Viele Liebesgaben dürfen nicht
mehr geschickt werden!
Die neneste Verfügnng in Hin—
sicht ans den Versand von Nah—
rungsmitteln nach Dentschland ist
unnn bekannt gemacht worden.
Danach ist der Versandt der fol­
genden Nahrungsmiitel verboten:
Butter, Fleisch und Fleischprodnk—-
te, Speck, Mehl, Zncker, Annanas,
Ginger, Vanille, Kaviar, Kaviar-
Substitute, Kaviar-Pickle, Kreb—
se, Anstern.
Dagegen dürfen Nahrungsmit--
tel versandt werden, wenn diese
für den persönlichen Ge—
branch des Empfängers bestimmt
sind. Aber. nnr die folgenden
Nahrungsmittel dürfen versandt
werdeu, sofern jeder einzelne Ar—
tikel nicht mehr wie zwei Pfund
beträgt: Margarine, Fette
(Schmalz), Bäckerwaren, (Bis­
guets, Crackers, etc.) Makaroni,
Zuckerwaren nnd andere Artikel,
welche unter den Tarif No. 202
zn stehen kommen.
Jedes Paket mag Seife, Ker­
zen und Stärke enthalten, jedoch
darß deren Gesammtgewicht nicht
mehr wie 5 Pfund betragen.
Die Palete dürfen nicht mehr
wie 11 Pfund wiegen. Es sei
noch einmal hier besonders her—
vorgehoben, daß Kleidnngsstücke,
Strümpfe, .Schnhe nnd andere
Sachen dieser Art nicht versandt
werden dürfen.

St. Johannis-Kirche.
Wir haben so vieles schon gehört
von Suppers id Tänzen und allem
Moöglichen, was veraustaltet wird, die
St. Johanneskirche bringt aber etwat
Neues, nämlich einen gemütlichen
„Kassee“, den sie am Montag, den
17. November geben wird. Wenn das
auch unglüeklicher Weise auf dassel­
be OVatum fällt wie der Ball des Ger—
mania Männerchors, so brauchen doch
die einen oder die anderen darunte­
nicht zu leiden. Denn diejenigen, dic
nicht auf den Ball gehen wollen, kön
nen zum Kaffee gehen und umgekehrt.
Oder besser noch: man kann zu bein
gehen, erst nach dem einen Platz und
dann nach dem anderen.
Concordia Gemeinde. .
Am Dienstag und Mittwoch näch—
ster Woche findet im Erdgeschoß der
Concordia Kirche ein Supper statt.
Alle Freunde und Gönner sind herz—
lichst willkommen. Der neue Pfarrer
der Gemeinde, Herr Locher, wird sich
vesonders freuen, die Mitglieder sei—
ner Gemeinde bei dieser Gelegenheit
begrüßen zu-dkrfen. —
Lnuchroll, Vealloaf, wirkliche Delika­
tessen, sind zu haben bei:
Bühlers, 36 —5 Riggs Markt.
— —
Germania Männer-Chor.
Ein altes Wort sagt: Man muß die
Jeste feiern wie sie fallen. Das näch
e Fest, das uns bevorsteht, ist der
Batl, den der Germania Männerchor
am nächsten Montag, den 17. d. M„
abends 8 Uhr, im Old Masonie Tem
pel veranstalten wird- Die Parole ist
also: Feiern! d. h. hingehen. Und
wer hingeht, wird es gewiß nicht be
rcuen Die Komites haben tüchtig
dorgearbeitet, es ist alles in bester
1 rdnung, so daß sich jeder gut amü
jieren wird.
— íAB w—
„Washington Sängerbund.“
Der Sängerbund hat sein Pro—
gramm für die Saison 1919 — 20 be
kannt gegeben. Danach finden statt:
am 27. November Danksagungstanz
und am 30. Nevember das erste Kon­
zert. In der schweren Zeit, die hin
tor uns liegt, haben alle Vereine zu
leiden gehabt, der Sängerbund aber
wohl am schwersten, denn er-hatte ein
Eigentum zu erhalten, und dieses Ei—
gentum war außerdem die letzte
deutsche Halle, die es in der Stadt
giebt. Um so mehr war der Appell,
den der Verein an das deutsche Ele—
ment richtete, ihn in der Erhaltung
dieses letzten deutschen Heims zu un—
terstüten, gerechtfertigt. Höffentlich
ist dieser Appell nicht ungehört ver­
hallt, so daß recht, recht viele sich an
diesem Danksagungstanz beteiligen
werden.

“ 2 2
D. C. Hülfsverein
für die Notleidenden in Dentschland
und Oesterreich.
—
Das Jahrmartktskomite des Hilfs
vereins tagte am letzten Freitag, um
seine Maßnahmen für den am 1. und
2. Dezember in der Sängerbundhalle
abzuhaltenden JFahrmarkt zu treffen.
Die Mitglieder des Komitees waren
alle gekommen, und der gewohnte En
thusiasmus herrschte wiederum bei
all den treuen Mitarbeitern. Die ein
zelnen Stände wurden vergeben, und
wenn nun die Besucher nicht ausblei
ben, dann verspricht, was Erfolg
heißt, sich diese Veranstaltung ihren
beiden Vorgängern würdig an die
Seite zu stellen. Weihnachten ist ja
so fern nicht mehr, und zu Weihnach
ten ist doch jeder bestrebt, seine Lieben
durch Geschente zu erfreuen. Warum
also nicht auf diesem Jahrmarlt kau
fen und damit ein gutes Werk tun
damit banger Not abhelfen bei tan
senden, denen wohl kein Weihnachts
baum seine Lichter erstrahlen lassen
wird, bei tausenden Kindern, die kei­
ne andere Weihnachtsfreude haben
verden, als daß sie sich mal wieder
satt essen können. Wer hier in barm
herziger Liebe sich der Darbenden an
ninmmt, der wird in seinem Herzen
zjewiß die allergrößte Weihnachtsfreu
de empfinden. In der Versammlung
machte derVorsitzende auch die erfren
liche Mitteilung, daß es ihm gelunger
ist, die Zusage verschiedener Künstler
in einem vom Hülfsverein im Januan
oder Februar zu veranstaltende-
Künstlerkonzert mitzuwirken, zu er
halten. Die Sekretrin des Vereins
Frau Dr. Eck, war abwesend. E—
war nämlich die Nachricht eingelan
fen, daß in Philidelphia ein deutsche
Segelschiff läge, dessen Bemannun
absolut nichts undtres zum Anziehen
hätte, als Luntpen Nach Besprech
ung mit dem Vorsitzenden begab si
sich mit Frau Bachrach zu Frau Ham
mel, und die Damen suchten dort vo
den eingelieferten Kleidern zwölf An
züge und das nötige Unterzeug aus
velches alles von Frau Eek nach Phi
ladelphia genommen und den Bedürf—
tigen ausgehändigt wurde. Wn
möchten den Bericht nicht schließen
ahne darauf hinzuweisen, daß heut
Abend, alio Freitag, den 14. No
vember, ein· Erxtraversammlung de­
ganzen Vereins in der Sängerbund
halle statttid.n wird, zu der all
Mitglieder dringend eingeladen sind
Italienische Truppen greifen d'An­
nunzio an.
Zwischen italienischen Regierungs
truppen und Streitkräften d'Annun
zio's ist es zu einem blutigen Zusam
mensto gekommen, in welchem di
Regierungstruppen bedeutende Ver
luste erlitten. Die Soldaten d'An
nunzio's hatten einen Toten un
mehrere Verwundete. — Unter dei
Scharen d'Annunzio's herrscht groß
Unzufriedenheit, weil die Nahrungs
mittel knapp werden. Die Mannes
zucht ist fast verschwunden.
Unrnhen in Italien wegen „Soviet
feier“.
Die sozialistischen Festlichkeiten zu
Ehren des zweiten Jahrestages. der
russischen „roten“ Revolution, welche
die Bolschewinten ans Rudber braechte
führten zu ernsten Ruhestörungen in
Mailand und Genuna. In WMailano
wurden in einem Zusammenstoß zwi
schen Truppen und den Sozialisten
mehrere Schüsse gewechselt und viele
Verhaftungen vorgenommen. In
Genua trieben die Soldaten sozialisti—
sche Umzüge, die durch rote Fahnen
und Bilder von Lenine kenntlich wa
ter mit der blanken Wafse auseinan—
er.

m nin vmd aerm
— Großer Ball
- Oild Masonie Temple,
2 8 9 Ecke Niunth and I Stro. N. m.
& E am Mortig, 17. Nov. 1917, 8 Uhr abends S
2 veranstaltet vom *
— ; : S
Germania Männer-Chor —
1 Eintritt do Cents. 2
ii it

Office: No. 710 Sechste Straße N. W.

Packete nach Deuntschland.
Diejenigen, die ihren Angehörigen
Eßwaren und Kleider und sonstige
Sachen senden, sollten in ihrer Aus­
wahl sehr vorsichtig sein, weil auf
manche Dinge ein so hoher Zoll liegt.
da in Sendungen garnicht mehr die
beabsichtigte Hülse gefunden werden
kann. Frau Mia Scharbau war gütig
genug, uns Material zur Verfügung
zu stellen, d. h,uns Daten und Bele­
ge an die Hand zu geben, aus denen
die hohen Zollgebühren ersehen wer­
den können. Aus dem Zuschreiben
von Frau Scharbau entnehmen wir
folgendes: „Ich schictte zwei Packete,
von denen das eine 2 Pfund Tabak
und 1 Dutzend Taschentücher, einige
Häkelarbeiten und alte getragene Sa­
chen erhielt. Der Zoll betrug Mk.
11,26 und „Aufgeld“ Mk. 47,81, zu­
sammen Mtk. 59,06, und das für eit ——
paar Sachen, deren Wert höchstens 5
var. Das andere Paket enthielt Sei—
se, Reis, Kakao Milch und Chokola—-
de Der Zoll darauf betrug nur Mk.
2,62. Auf Kaffee, Milch (kondensier­
te Reis, Mehl, Schmalz, Butter.
Lorned Lees und geräucherte Wurst
ist sehr wenig Zoll, auf Zucker etwas
mehr. Neue Sachen, fertige sowohl
wie ungenähte, müssen sehr hoch ver­
zollt werden, auch wenn sie als Lie—
besgaben geschickt werden, ebenso
Schuhe und Tabak. Mein Bruder
schrieb, der Zollbeamte rechnete den
Tabak (Prinz Albert) als Grob—
schnitt); hätte er ihn als Feinschnitt
derechnet, hätte er den Zoll nicht zu —
bezahlen brauchen. Auf dem Zollamt
var auch eine alte, ärmlich gekleidete
Frac welche ein Paket mit Lebens­
mitteln von ihrem Sohne aus New
Yortk bekommen hatte. Dasselbe ent­
hielt außerdem 20 Schachteln Ciga
retten und ein paar kleine Cigarren
Cigarillos). Die Cigarotten mußte
die Frau mit 12 Mark und die klei
en Cigarren mit 3 Mark das Stück
verzollen. Und doch freuen sich die
Leute, wenn sie mal wirklichen Tahar
zu rauchen bekommen, denn selbit „er
Tabak aus Buchenlaub, welcher als
Reichsware“ verkauft wird, muß
versteuert werden“. Aus dem Vorste-
Jenden werden unsere Leser leicht
entnehmen können,. was sie senden
Aallten, um ihren Angehörigen unnö—
tig hohe Zollgebühren zu ersparen.
Die Zollgebühren müssen in Gold ent­
richtet werden. Gold ist aber in nur
sehr Weniger Besit, und deshalb ist
im Nichtfalle ein „Aufgeld“ zu ent—
richten, das 475 Prozent beträgt.
Also in anderen Worten: Wenn in
Deutschland jemand ein Paket erhält
und der Zoll beträgt 5 Mark, die er
Cinpfänger aber nicht in Gold bezah—
len kann, so muß er ein „Aufgeld“
von ungefähr 50 Mark nebst Zoll be­
zahlen.
Auch der Franc entwertet sich.
Nicht nur die deutsche Mark, auch
der Franc entwertete sich. In sol—
dem Maße sogar, daß die französische
Regierung beabsichtigt, eine Sonder­
näission nach den Ver. Staaten zu
schicken, um die Hülse der amerikani­
schen Finanziers anzurufen. Es
fragt sich aber nun, ob die amerika—
nischen Finanziers ihr gutes Geld —
dem schlechten französischen nachwer—
ten, denn inzwischen ist man aus der
Hypnose der Französelei, in welche
aeschickte Propaganda Amerika einge­
lillt hatte, erwacht und man beginnt
die Dinge wieder mit klaren Augen
zu sehen.
M
Zu mieten gesucht:
Ein oder zwei unmöblierte gim­
mer bei deutschen Leuten. Offerten
sende man unter A. W. an die Expe­
dition dieser Zeitung.

",././0759.tif,
